久康街２４巷７號５樓之５,久康La Vie,104/11/07,960,49.4,19.44,58.91%,華廈(10層含以下有電梯),9,五層/八層,房地(土地+建物),土:1 建:1車:0,2房1廳1衛,,有,無,住家用,含增建或未登記建物。含增建或未登記建物。;,,
羅斯福路六段２８８之１號,,104/11/06,1300,43.5,29.89,100.00%,公寓(5樓含以下無電梯),,二層/四層,房地(土地+建物),土:1 建:1車:0,2房1廳1衛,,無,無,住家用,親友間之交易。親友、員工或其他特殊關係間之交易。;,,
羅斯福路六段２８８之２號,,104/11/06,1300,43.5,29.89,100.00%,公寓(5樓含以下無電梯),,三層/四層,房地(土地+建物),土:1 建:1車:0,3房1廳1衛,,無,無,住家用,親友間之交易。親友、員工或其他特殊關係間之交易。;,,
景興路２０２巷１１號５樓之６,,104/11/06,1600,61.7,25.94,61.00%,住宅大樓(11層含以上有電梯),23,五層/十六層,房地(土地+建物),土:1 建:1車:0,2房2廳1衛,,有,無,商業用,含增建或未登記建物。含增建或未登記建物。;,,
興順街１９３號五樓,,104/11/06,556,20.8,26.73,74.06%,公寓(5樓含以下無電梯),16,五層/五層,房地(土地+建物),土:1 建:1車:0,3房2廳2衛,,無,無,住家用,親友、員工或其他特殊關係間之交易。親友、員工或其他特殊關係間之交易。;,,
福興路６３巷７號五樓之２,,104/11/06,440,38,11.59,59.87%,套房(1房(1廳)1衛),21,五層/五層,房地(土地+建物),土:2 建:1車:0,1房1廳1衛,,無,無,住家用,,,
萬壽路１１３號,,104/11/05,300,30,10.02,,店面（店舖),55,一層/一層,房地(土地+建物),土:1 建:1車:0,,,無,無,商業用,親友、員工或其他特殊關係間之交易。所有權人共三人親友、員工或其他特殊關係間之交易。;,,
興隆路１段７０巷９弄１８號,,104/11/05,931.4,35.3,26.37,100.00%,公寓(5樓含以下無電梯),44,一層/四層,房地(土地+建物),土:2 建:1車:0,3房2廳1衛,,無,無,住家用,親友、員工或其他特殊關係間之交易。親友、員工或其他特殊關係間之交易。;,,
光輝路１２６號,,104/11/05,1800,46.4,38.76,64.70%,公寓(5樓含以下無電梯),21,一層/五層,房地(土地+建物),土:3 建:1車:0,3房2廳2衛,,無,無,住家用,親友、員工或其他特殊關係間之交易。親友、員工或其他特殊關係間之交易。;,,
仙岩路１６巷３８號二樓,,104/11/05,1200,42.8,28.03,100.00%,公寓(5樓含以下無電梯),,"二層,陽台/四層",房地(土地+建物),土:1 建:1車:0,3房2廳1衛,,無,無,住家用,,,
辛亥路四段７７巷９２弄１１號五樓之９,愛眉山莊,104/11/05,530,40.5,13.09,60.00%,套房(1房(1廳)1衛),12,五層/十四層,房地(土地+建物),土:3 建:1車:0,1房1廳1衛,,有,無,住家用,土地及建物分次登記案件。前案土地登記收件字號：;,,
福興路１０６巷２５號５樓,敦南觀止,104/11/05,2150,54.7,39.27,57.89%,住宅大樓(11層含以上有電梯),3,五層/十四層,房地(土地+建物),土:1 建:1車:0,3房2廳2衛,,有,無,住家用,私契於民國104年10月10日雙方自行訂定。,,
羅斯福路六段４５５巷６號６樓,台北紐約,104/11/04,2050,72.9,28.13,,辦公商業大樓,9,六層/十五層,房地(土地+建物),土:1 建:1車:0,2房2廳1衛,,有,無,辦公用,,,
萬安街５６巷５號６樓之２,萬芳,104/11/04,610,43.8,13.92,68.56%,套房(1房(1廳)1衛),32,六層/七層,房地(土地+建物),土:3 建:1車:0,1房1廳1衛,,有,無,住家用,含增建或未登記建物。含增建或未登記建物。;,,
萬寧街２巷７號,,104/11/04,2800,41.2,68.04,94.14%,公寓(5樓含以下無電梯),28,一層/四層,房地(土地+建物),土:1 建:2車:0,3房2廳2衛,,無,無,住家用,,,
木柵路二段１０９巷１００弄４０之１號六樓,觀星台北,104/11/04,330,37.4,8.82,60.45%,套房(1房(1廳)1衛),19,六層/十七層,房地(土地+建物),土:2 建:1車:0,1房0廳1衛,,有,無,住家用,,,
育英街１７巷１６之１號四樓,,104/11/02,1200,38.8,30.89,100.00%,公寓(5樓含以下無電梯),,"四層,陽台/四層",房地(土地+建物),土:2 建:1車:0,3房2廳2衛,,無,無,住家用,,,
羅斯福路五段４９號二樓,滿庭芳,104/11/02,516,20.6,25.1,80.03%,華廈(10層含以下有電梯),,二層/七層,房地(土地+建物),土:3 建:1車:0,2房1廳1衛,,有,無,住家用,親友、員工或其他特殊關係間之交易。親友、員工或其他特殊關係間之交易。;,,
興隆路四段８巷１１號２樓,,104/11/02,738,36.5,20.25,100.00%,公寓(5樓含以下無電梯),,二層/四層,房地(土地+建物),土:1 建:1車:0,3房2廳1衛,,無,無,住家用,含增建或未登記建物。含增建或未登記建物。;,,
萬安街１２巷２號七樓之３,台北市萬安,104/11/02,1568,47.9,32.76,65.40%,華廈(10層含以下有電梯),32,七層/七層,房地(土地+建物),土:1 建:1車:0,3房2廳1衛,,有,無,住家用,,,
忠順街二段１１８號８樓,立體世界,104/11/01,698,47.7,14.63,64.87%,套房(1房(1廳)1衛),19,"八層,電梯樓梯間/八層",房地(土地+建物),土:1 建:1車:0,1房1廳1衛,,有,無,住家用,含增建或未登記建物。含增建或未登記建物。;,,
興隆路三段１８５巷７弄２號三樓,,104/11/01,1390,37.4,37.15,68.27%,公寓(5樓含以下無電梯),32,三層/五層,房地(土地+建物),土:7 建:1車:0,2房2廳2衛,,無,無,住家用,,,
試院路１５４巷３弄１２號３樓,,104/11/01,920,23.4,39.25,86.55%,公寓(5樓含以下無電梯),34,三層/四層,房地(土地+建物),土:2 建:1車:0,4房2廳2衛,,無,無,住家用,含增建或未登記建物。含增建或未登記建物。;,,
景興路１０８巷１號三樓,,104/11/01,2150,42.3,50.85,100.00%,公寓(5樓含以下無電梯),47,三層/四層,房地(土地+建物),土:1 建:1車:0,5房2廳3衛,,無,無,住家用,,,
辛亥路四段２１巷１２號３樓之１,南方藝術宮殿,104/10/31,770,52.1,14.78,71.98%,套房(1房(1廳)1衛),20,三層/十八層,房地(土地+建物),土:4 建:1車:0,1房1廳1衛,,有,無,住家用,含增建或未登記建物。內含獨立產權公設，未包含在棟數內。含增建或未登記建物。;,,
忠順街一段２６巷１弄１０號３樓,橡園撰,104/10/31,1010,39.5,25.58,100.00%,公寓(5樓含以下無電梯),40,"三層,陽台/四層",房地(土地+建物),土:1 建:1車:0,3房2廳1衛,,無,無,住家用,,,
忠順街二段１００號,立體世界,104/10/30,900,54.2,16.61,,店面（店舖),19,"一層,騎樓/八層",房地(土地+建物),土:1 建:1車:0,1房1廳1衛,,有,無,商業用,,,
木柵路一段３７８巷１５號二樓,,104/10/30,785,29.3,26.83,85.41%,公寓(5樓含以下無電梯),,二層/四層,房地(土地+建物),土:1 建:1車:0,3房2廳1衛,,有,無,住家用,,,
興隆路三段２２１巷２弄１５號２樓,家家,104/10/30,930,31.1,29.87,84.04%,公寓(5樓含以下無電梯),35,二層/五層,房地(土地+建物),土:3 建:1車:0,3房2廳2衛,,有,無,住家用,含增建或未登記建物。含增建或未登記建物。;,,
興隆路４段２９巷３弄９之２號,,104/10/30,250,18.2,13.74,90.80%,公寓(5樓含以下無電梯),33,一層/五層,房地(土地+建物),土:2 建:1車:0,1房2廳1衛,,無,無,住家用,親友、員工或其他特殊關係間之交易。親友、員工或其他特殊關係間之交易。;,,
景興路１８８號八樓之１１,巨星廣場大廈住商,104/10/30,540,39.4,13.71,44.79%,套房(1房(1廳)1衛),20,八層/二十四層,房地(土地+建物),土:1 建:1車:0,1房1廳1衛,,有,無,商業用,,,
木新路二段１３９號三樓,,104/10/29,1150,35.9,32.03,87.47%,公寓(5樓含以下無電梯),31,三層/五層,房地(土地+建物),土:2 建:1車:0,3房2廳2衛,,無,無,住家用,,,
興德路２０巷３６號五樓,欣聯芳朵,104/10/28,659,67.4,9.77,55.22%,套房(1房(1廳)1衛),,五層/十二層,房地(土地+建物),土:2 建:1車:0,,,有,無,住家用,建物第一次登記後移轉,,
忠順街２段５２號２樓,蘭亭怡園,104/10/28,1080,34.4,31.35,62.12%,華廈(10層含以下有電梯),31,二層/七層,房地(土地+建物),土:1 建:1車:0,3房2廳2衛,,有,無,住家用,,,
忠順街２段８５巷２７號１０樓,,104/10/28,3787,64.6,58.65,54.13%,住宅大樓(11層含以上有電梯),3,十層/十五層,房地(土地+建物),土:1 建:1車:0,3房2廳2衛,,有,無,住家用,本戶為地主保留戶,,
光輝路７０號三樓,,104/10/27,1100,28.1,39.1,79.79%,公寓(5樓含以下無電梯),34,三層/五層,房地(土地+建物),土:2 建:1車:0,4房2廳2衛,,有,無,住家用,,,
辛亥路四段２２２巷１７號二樓,敦品,104/10/27,1000,31.9,31.37,93.28%,公寓(5樓含以下無電梯),35,二層/五層,房地(土地+建物),土:1 建:1車:0,3房2廳2衛,,無,無,住家用,,,
木柵路二段１０９巷２５弄２６號３樓,,104/10/27,898,38.5,23.34,85.87%,公寓(5樓含以下無電梯),33,三層/四層,房地(土地+建物),土:1 建:1車:0,3房2廳2衛,,有,無,住家用,含增建或未登記建物。含增建或未登記建物。;,,
景華街１５０巷１７號,,104/10/26,1170,49.9,23.45,88.20%,公寓(5樓含以下無電梯),38,一層/四層,房地(土地+建物),土:1 建:1車:0,4房2廳2衛,,無,無,住家用,含增建或未登記建物。含增建或未登記建物。;,,
景興路２８６號六樓,,104/10/26,1780,45.3,39.28,82.83%,住宅大樓(11層含以上有電梯),24,六層/十三層,房地(土地+建物),土:1 建:1車:0,3房2廳1衛,,有,無,其他,,,
木新路三段３３９巷６號五樓,,104/10/26,1050,43.4,24.19,72.87%,公寓(5樓含以下無電梯),31,五層/五層,房地(土地+建物),土:1 建:1車:0,2房1廳1衛,,無,無,住家用,,,
木新路二段１１１巷１２弄１２號二樓,,104/10/26,700,24.6,28.5,75.36%,公寓(5樓含以下無電梯),30,二層/五層,房地(土地+建物),土:1 建:1車:0,2房2廳1衛,,無,無,住家用,親友、員工或其他特殊關係間之交易。親友、員工或其他特殊關係間之交易。;,,
富山路１巷２８號三樓,,104/10/25,488,38.1,12.82,83.12%,公寓(5樓含以下無電梯),,三層/四層,房地(土地+建物),土:1 建:1車:0,3房1廳1衛,,無,無,住家用,二親等買賣親友、員工或其他特殊關係間之交易。;,,
秀明路一段１９巷１６號３樓,幸福新城,104/10/25,1418,35.8,39.62,87.08%,公寓(5樓含以下無電梯),35,三層/五層,房地(土地+建物),土:1 建:1車:0,3房2廳2衛,,無,無,住家用,含增建或未登記建物。含增建或未登記建物。;,,
福興路９５巷１７之２號３樓,太平洋LOHAS,104/10/25,1350,45,30.03,65.44%,華廈(10層含以下有電梯),8,三層/十層,房地(土地+建物),土:1 建:1車:0,3房2廳2衛,,有,無,住家用,,,
景明街２７之１號４樓,香榭新廈,104/10/25,1910,51.2,37.33,78.02%,華廈(10層含以下有電梯),25,四層/七層,房地(土地+建物),土:1 建:1車:0,3房2廳2衛,,無,無,住家用,,,
保儀路１０９巷２１弄２０號３樓,,104/10/24,1025,36.4,28.17,100.00%,公寓(5樓含以下無電梯),43,"三層,陽台/四層",房地(土地+建物),土:1 建:1車:0,3房2廳1衛,,無,無,住家用,含增建或未登記建物。含增建或未登記建物。;,,
羅斯福路五段９７巷８號五樓,,104/10/23,1300,58.2,22.35,85.88%,公寓(5樓含以下無電梯),,五層/五層,房地(土地+建物),土:2 建:1車:0,3房2廳1衛,,無,無,住家用,,,
興隆路二段２０３巷９０號８樓,敦南如意,104/10/23,1200,51.3,23.38,66.83%,住宅大樓(11層含以上有電梯),18,八層/十一層,房地(土地+建物),土:1 建:1車:0,2房2廳1衛,,有,無,住家用,含增建或未登記建物。含增建或未登記建物。;,,
保儀路３１號,,104/10/22,550,50.6,10.87,,公寓(5樓含以下無電梯),,"一層,騎樓,停車場,通道,門廳/四層",房地(土地+建物),土:1 建:1車:0,,,無,無,商業用,本案係屬持分產權買賣案件,,
試院路５４號４樓之１,,104/10/22,820,37.9,21.66,69.42%,公寓(5樓含以下無電梯),34,四層/五層,房地(土地+建物),土:1 建:1車:0,4房1廳4衛,,無,無,住家用,,,
景興路９１巷２４號三樓,,104/10/21,250,21.9,11.4,,公寓(5樓含以下無電梯),,"陽台,三層/四層",房地(土地+建物),土:1 建:1車:0,3房2廳1衛,,無,無,住家用,親友、特殊關係間之交易。親友、員工或其他特殊關係間之交易。;,,
興隆路二段９６巷４６號,,104/10/21,4450,0,74.98,,透天厝,,全/二層,房地(土地+建物),土:2 建:1車:0,7房3廳3衛,,有,無,住家用,含增建或未登記建物。共有人共2人含增建或未登記建物。;,,
興隆路三段１８５巷３弄３號３樓,,104/10/21,830,31.6,26.24,74.71%,公寓(5樓含以下無電梯),32,三層/五層,房地(土地+建物),土:7 建:1車:0,3房2廳2衛,,有,無,住家用,,,
福興路６３巷４弄３號三樓,,104/10/20,550,18.9,29.13,100.00%,公寓(5樓含以下無電梯),,"三層,陽台/四層",房地(土地+建物),土:1 建:1車:0,3房1廳1衛,,無,無,住家用,父女他特殊關係間之交易。親友、員工或其他特殊關係間之交易。;,,
秀明路一段１９巷５弄１２號二樓,,104/10/20,1100,36.1,30.45,75.34%,公寓(5樓含以下無電梯),32,二層/五層,房地(土地+建物),土:1 建:1車:0,3房2廳1衛,,無,無,住家用,,,
政大一街２４８號,臻園,104/10/20,2000,0,38.63,,透天厝,10,全/三層,房地(土地+建物),土:1 建:1車:0,3房1廳3衛,,有,無,住家用,,,
和平東路四段６５巷２７弄１０之６號,,104/10/20,2600,0,49.92,,透天厝,28,全/三層,房地(土地+建物),土:1 建:1車:0,4房2廳3衛,,有,無,住家用,親友、員工或其他特殊關係間之交易。權利人2人親友、員工或其他特殊關係間之交易。;,,
忠順街二段１１號三樓,,104/10/20,1220,34.9,34.91,77.40%,公寓(5樓含以下無電梯),31,三層/五層,房地(土地+建物),土:1 建:1車:0,4房1廳2衛,,無,無,住家用,,,
萬壽路７５之１號,葉綠素,104/10/19,1190,60.8,19.57,63.83%,華廈(10層含以下有電梯),7,一層/五層,房地(土地+建物),土:1 建:1車:0,1房2廳1衛,,有,無,住家用,,,
興德路６２巷２號五樓,,104/10/19,1010,42.2,23.93,86.53%,公寓(5樓含以下無電梯),,五層/五層,房地(土地+建物),土:1 建:1車:0,3房2廳1衛,,無,無,住家用,頂樓增建2房2廳1衛含增建或未登記建物。;,,
萬隆街６之２號三樓,,104/10/19,630,23,27.35,92.76%,公寓(5樓含以下無電梯),,三層/五層,房地(土地+建物),土:2 建:1車:0,3房2廳1衛,,無,無,住家用,親友、員工或其他特殊關係間之交易。 權利人共2人親友、員工或其他特殊關係間之交易。;,,
辛亥路四段７７巷９２弄１１號１３樓之１,愛眉山莊,104/10/18,580,44,13.19,59.56%,套房(1房(1廳)1衛),12,十三層/十四層,房地(土地+建物),土:3 建:1車:0,1房1廳1衛,,有,無,住家用,含增建或未登記建物。;,,
和興路８之１號５樓,,104/10/18,1330,39.7,33.48,82.26%,公寓(5樓含以下無電梯),26,五層/五層,房地(土地+建物),土:1 建:1車:0,3房2廳2衛,,無,無,住家用,含增建或未登記建物。含增建或未登記建物。;,,
木新路二段１１號十一樓,綠隄,104/10/18,730,13,56.19,38.03%,住宅大樓(11層含以上有電梯),20,/十四層,房地(土地+建物),土:1 建:1車:0,2房2廳2衛,,無,無,住家用,1.本案為二親等間買賣。 2.此資料由權利人提供。親友、員工或其他特殊關係間之交易。;,,
萬芳路１０７巷１６號３樓,九昱十美,104/10/18,2330,54,43.13,59.32%,住宅大樓(11層含以上有電梯),3,三層/十五層,房地(土地+建物),土:1 建:1車:0,4房2廳2衛,,有,無,住家用,,,
試院路２４號四樓,,104/10/17,1266,39.1,32.39,82.16%,公寓(5樓含以下無電梯),,四層/五層,房地(土地+建物),土:1 建:1車:0,3房2廳2衛,,無,無,住家用,,,
興隆路二段２２０巷５５弄４號,,104/10/17,1783,56.7,31.47,100.00%,公寓(5樓含以下無電梯),,"一層,平台/四層",房地(土地+建物),土:1 建:1車:0,3房2廳1衛,,無,無,住家用,共有人數2人 含增建或未登記建物。含增建或未登記建物。;,,
萬安街１號５樓之２,萬芳,104/10/17,1018,35.6,28.6,68.21%,住宅大樓(11層含以上有電梯),32,五層/十二層,房地(土地+建物),土:3 建:1車:0,3房2廳1衛,,有,無,住家用,含增建或未登記建物。含增建或未登記建物。;,,
景華街３巷６號四樓之２,,104/10/16,660,16.7,39.52,71.56%,華廈(10層含以下有電梯),32,四層/七層,房地(土地+建物),土:1 建:1車:0,3房1廳2衛,,無,無,住家用,親友、員工或其他特殊關係間之交易。親友、員工或其他特殊關係間之交易。;,,
試院路１４４巷４弄１４號２樓,世說新語,104/10/16,380,36.9,10.29,57.47%,套房(1房(1廳)1衛),21,二層/七層,房地(土地+建物),土:7 建:1車:0,1房0廳1衛,,有,無,住家用,含增建或未登記建物。含增建或未登記建物。;,,
興隆路二段１５３巷３弄８號四樓,,104/10/16,800,27.9,28.65,84.00%,公寓(5樓含以下無電梯),,四層/四層,房地(土地+建物),土:1 建:1車:0,3房2廳1衛,,無,無,住家用,親友、員工或其他特殊關係間之交易。親友、員工或其他特殊關係間之交易。;,,
試院路４巷３號,,104/10/16,6200,0,71.1,,透天厝,7,全/二層,房地(土地+建物),土:3 建:1車:0,,,無,無,其他,親友、員工或其他特殊關係間之交易。 (包含)公共設施保留地之交易。親友、員工或其他特殊關係間之交易。;,,
興隆路３段１８１巷９弄１號３樓,,104/10/16,1200,41.9,28.66,86.05%,公寓(5樓含以下無電梯),,三層/三層,房地(土地+建物),土:1 建:1車:0,3房1廳1衛,,無,無,住家用,含增建或未登記建物。含增建或未登記建物。;,,
興隆路二段２７５巷１弄８號九樓,鳳璽花園,104/10/16,1180,54.7,21.57,62.60%,住宅大樓(11層含以上有電梯),21,九層/十四層,房地(土地+建物),土:2 建:1車:0,2房2廳1衛,,有,無,住家用,,,
興隆路三段２０７巷５弄２號三樓,,104/10/15,1120,30,37.27,71.60%,公寓(5樓含以下無電梯),34,三層/五層,房地(土地+建物),土:2 建:1車:0,3房2廳2衛,,無,無,住家用,,,
萬盛街７４號,,104/10/15,775,24.3,31.93,100.00%,公寓(5樓含以下無電梯),44,"一層,露台/四層",房地(土地+建物),土:2 建:1車:0,3房2廳1衛,,無,無,住家用,本案為親屬間買賣，不動產登記人數為２人,,
羅斯福路六段４６９巷２７號十五樓,第凡內,104/10/15,1650,67.3,24.52,61.37%,住宅大樓(11層含以上有電梯),3,十五層/十八層,房地(土地+建物),土:1 建:1車:0,2房1廳1衛,,有,無,住家用,,,
辛亥路四段２１巷２８號,,104/10/14,1300,38.4,33.82,90.05%,公寓(5樓含以下無電梯),29,一層/五層,房地(土地+建物),土:1 建:1車:0,3房2廳2衛,,有,無,住家用,親友、員工或其他特殊關係間之交易。親友、員工或其他特殊關係間之交易。;,,
木柵路２段１０９巷１３７號３樓,南方桃花源,104/10/14,925,30.9,29.9,81.37%,公寓(5樓含以下無電梯),28,三層/五層,房地(土地+建物),土:4 建:1車:0,3房2廳2衛,,有,無,住家用,親友、員工或其他特殊關係間之交易。親友、員工或其他特殊關係間之交易。;,,
羅斯福路五段２３４之１號四樓,,104/10/14,1690,54.5,31.04,86.48%,公寓(5樓含以下無電梯),29,四層/七層,房地(土地+建物),土:1 建:1車:0,3房2廳2衛,,無,無,住家用,,,
萬安街６８之３號,萬芳,104/10/13,1080,59.8,18.07,70.52%,華廈(10層含以下有電梯),32,一層/七層,房地(土地+建物),土:3 建:1車:0,2房1廳1衛,,有,無,住家用,,,
木柵路四段１５９巷１７０弄９號,,104/10/13,230.5,6.7,34.45,80.97%,公寓(5樓含以下無電梯),33,一層/五層,房地(土地+建物),土:2 建:1車:0,3房2廳2衛,,無,無,商業用,本不動產交易係屬近親間之買賣行為。,,
興隆路一段７０巷１１弄２３之４號４樓,,104/10/13,1500,40.1,37.4,100.00%,公寓(5樓含以下無電梯),,"四層,陽台/四層",房地(土地+建物),土:1 建:1車:0,6房3廳3衛,,無,無,住家用,含增建或未登記建物。含增建或未登記建物。;,,
福興路６３巷４弄１１號６樓之１,興隆及第,104/10/12,955,44,21.68,76.17%,華廈(10層含以下有電梯),18,"六層,電梯樓梯間/八層",房地(土地+建物),土:3 建:1車:0,2房2廳1衛,,有,無,住家用,,,
木新路二段１３號５樓,綠隄,104/10/11,800,52.3,15.3,61.21%,套房(1房(1廳)1衛),20,五層/十層,房地(土地+建物),土:1 建:1車:0,1房1廳1衛,,有,無,住家用,,,
羅斯福路六段１４２巷２０弄２３號５樓,力霸南京二期,104/10/10,1500,67.8,22.13,68.91%,華廈(10層含以下有電梯),20,"五層,電梯樓梯間/十層",房地(土地+建物),土:1 建:1車:0,2房2廳1衛,,有,無,住家用,含增建或未登記建物。含增建或未登記建物。;,,
辛亥路七段８４巷３２弄４號４樓,,104/10/10,1300,55.6,23.4,90.07%,公寓(5樓含以下無電梯),,四層/四層,房地(土地+建物),土:2 建:1車:0,2房2廳1衛,,無,無,住家用,含增建或未登記建物。含增建或未登記建物。;,,
忠順街一段９巷１１號,,104/10/09,680,15.7,43.43,72.12%,公寓(5樓含以下無電梯),34,一層/五層,房地(土地+建物),土:2 建:1車:0,3房2廳2衛,,無,無,住家用,親友、員工或其他特殊關係間之交易。親友、員工或其他特殊關係間之交易。;,,
仙岩路２２巷２７號１４樓,,104/10/09,1100,47.3,23.24,63.77%,住宅大樓(11層含以上有電梯),20,十四層/十五層,房地(土地+建物),土:1 建:1車:0,2房2廳1衛,,有,無,住家用,,,
羅斯福路五段１１８號,,104/10/08,2588,68.9,37.56,,店面（店舖),,一層/五層,房地(土地+建物),土:1 建:1車:0,4房1廳1衛,,無,無,住商用,,,
羅斯福路四段２２８號三樓,,104/10/08,2000,62.5,31.99,100.00%,公寓(5樓含以下無電梯),39,三層/四層,房地(土地+建物),土:2 建:1車:0,3房2廳2衛,,無,無,住家用,,,
景美街１０２號,,104/10/07,3584.5,149.2,24.02,,店面（店舖),,"一層,騎樓/一層",房地(土地+建物),土:1 建:1車:0,1房1廳1衛,,無,無,住家用,,,
辛亥路四段２５８號２樓,,104/10/07,1058,55.2,19.17,61.83%,套房(1房(1廳)1衛),20,"二層,電梯樓梯間/五層",房地(土地+建物),土:1 建:1車:0,1房1廳1衛,,有,無,住家用,含增建或未登記建物。 撤件重報(原申報書序號A2AA10412020023)含增建或未登記建物。;,,
福興路７８巷２０弄２３號四樓,,104/10/07,690,24.5,28.12,85.36%,公寓(5樓含以下無電梯),,四層/五層,房地(土地+建物),土:1 建:1車:0,3房2廳2衛,,無,無,住家用,,,
興隆路三段８４號,,104/10/07,440,26.9,16.38,87.92%,公寓(5樓含以下無電梯),36,"一層,騎樓,停車場/五層",房地(土地+建物),土:1 建:1車:0,1房1廳1衛,,無,無,其他,親友、員工或其他特殊關係間之交易。親友、員工或其他特殊關係間之交易。;,,
木柵路一段２５９號二樓,,104/10/07,1400,37.4,37.4,100.00%,公寓(5樓含以下無電梯),,二層/五層,房地(土地+建物),土:1 建:1車:0,3房2廳2衛,,無,無,住家用,親友、員工或其他特殊關係間之交易。親友、員工或其他特殊關係間之交易。;,,
景中街３０巷１２之１６號,景美民生大樓,104/10/07,531.7,54.1,9.82,,店面（店舖),28,一層/七層,房地(土地+建物),土:1 建:1車:0,,,有,無,商業用,關係人交易,,
景中街３０巷１２號,,104/10/07,148.3,49.6,2.99,,店面（店舖),28,一層/七層,房地(土地+建物),土:1 建:1車:0,,,有,無,商業用,關係人交易,,
羅斯福路四段２０８號四樓,,104/10/07,900,29,31.08,92.25%,公寓(5樓含以下無電梯),,四層/五層,房地(土地+建物),土:1 建:1車:0,3房2廳2衛,,無,無,住家用,親友、員工或其他特殊關係間之交易。親友、員工或其他特殊關係間之交易。;,,
興隆路三段１１２巷２弄９號三樓,,104/10/06,1300,42.8,30.4,87.36%,公寓(5樓含以下無電梯),36,三層/五層,房地(土地+建物),土:1 建:1車:0,3房2廳1衛,,無,無,住家用,,,
木新路三段３１０巷１４弄１８號四樓,,104/10/06,841.5,38.9,21.61,89.74%,公寓(5樓含以下無電梯),38,四層/四層,房地(土地+建物),土:1 建:1車:0,3房2廳1衛,,無,無,住家用,,,
萬芳路１０５巷４９號３樓,棕櫚泉綠茵山莊,104/10/05,1858,54.5,34.11,73.63%,住宅大樓(11層含以上有電梯),20,三層/十二層,房地(土地+建物),土:5 建:1車:0,3房2廳2衛,,有,無,住家用,,,
木新路三段３１０巷１４弄８號四樓,,104/10/05,630,19.5,32.31,100.00%,公寓(5樓含以下無電梯),,"四層,陽台/四層",房地(土地+建物),土:3 建:1車:0,5房2廳3衛,,無,無,住家用,親友、員工或其他特殊關係間之交易。 含增建或未登記建物。親友、員工或其他特殊關係間之交易。;含增建或未登記建物。;,,
興隆路三段１３７號７樓之１０,麗池PARTY,104/10/05,660,71.8,9.19,55.64%,套房(1房(1廳)1衛),7,七層/十層,房地(土地+建物),土:1 建:1車:0,1房1廳1衛,,有,無,住家用,含增建或未登記建物。含增建或未登記建物。;,,
景華街１０４巷３號二樓,,104/10/05,500,36.9,13.56,89.78%,公寓(5樓含以下無電梯),36,二層/五層,房地(土地+建物),土:2 建:1車:0,2房1廳1衛,,無,無,住家用,權利人共兩人; 親友、員工或其他特殊關係間之交易。親友、員工或其他特殊關係間之交易。;,,
景興路２５８號１１樓之４,康橋原味,104/10/05,1075,58,18.52,60.87%,套房(1房(1廳)1衛),13,十一層/十二層,房地(土地+建物),土:1 建:1車:0,1房1廳1衛,,有,無,住家用,含增建或未登記建物。含增建或未登記建物。;,,
